<?xml version="1.0" encoding="UTF-8"?>
<!-- edited with XMLSpy v2007 sp1 (http://www.altova.com) by SS (EMBRACE) -->
<!--Sample XML file generated by XMLSpy v2007 sp1 (http://www.altova.com)-->
<miltns:Order xmlns:miltns="http://www.matson.com/milportal/schema" xmlns:xsi="http://www.w3.org/2001/XMLSchema-instance" xsi:schemaLocation="http://www.matson.com/milportal/schema C:\dev\MIL_Portals\MIL_Schema\external\Order.xsd">
	<miltns:createdDate>2001-12-17T09:30:47.0Z</miltns:createdDate>
	<miltns:commandType>UPDATE</miltns:commandType>
	<miltns:orderNumber>12345</miltns:orderNumber>
	<miltns:orderStatus>Picked Up</miltns:orderStatus>
	<miltns:primaryReferenceNumber>12345</miltns:primaryReferenceNumber>
	<miltns:Shipment>
	  <miltns:Stop>
		<miltns:sequenceNo>S1</miltns:sequenceNo>
		<miltns:stopType>S</miltns:stopType>
		<miltns:locationName>TRANSWELL LOGISTICS INC</miltns:locationName>
		<miltns:locationID>11987700</miltns:locationID>
		<miltns:actualArrival>2001-12-17T09:30:47.0Z</miltns:actualArrival>
		<miltns:actualDeparture>2001-12-17T09:30:47.0Z</miltns:actualDeparture>
        <miltns:StopEvent xsi:type="miltns:StopEventType">
          <miltns:eventID>10034</miltns:eventID>
          <miltns:eventType>APU</miltns:eventType>
          <miltns:note>notes</miltns:note>
          <miltns:eventDateTime>2001-12-17T09:30:47.0Z</miltns:eventDateTime>
        </miltns:StopEvent>
	  </miltns:Stop>
	</miltns:Shipment>
</miltns:Order>
